{
  "schema_version": "1.0",
  "kind": "context-bundle",
  "id": "synthetic-example",
  "task_id": null,
  "role": "synthetic-example",
  "documents": [
    {
      "path": "synthetic-example",
      "sha256": "bbbbbbbbbbbbbbbbbbbbbbbbbbbbbbbbbbbbbbbbbbbbbbbbbbbbbbbbbbbbbbbb"
    }
  ],
  "dependency_handoffs": [],
  "sibling_handoffs": [],
  "interface_refs": [],
  "review_1_ref": null,
  "acceptance_ids": [
    "synthetic-example"
  ],
  "estimated_tokens": 0,
  "token_budget": 1,
  "digest": "bbbbbbbbbbbbbbbbbbbbbbbbbbbbbbbbbbbbbbbbbbbbbbbbbbbbbbbbbbbbbbbb",
  "omitted_optional_refs": [],
  "required_context_complete": false
}
